{
  "schema": "roados-app-surface-registry-v1",
  "version": "1.0.0",
  "observedAt": "2026-09-09T06:45:00Z",
  "source": "current-session-plugin-and-connector-surface",
  "availabilityIsAuthentication": false,
  "apps": {
    "ace-knowledge-graph": {"label": "Ace Knowledge Graph", "capability": "knowledge-graph"},
    "ai-task-brief-builder": {"label": "AI Task Brief Builder", "capability": "briefs"},
    "ai-voice-generator": {"label": "AI Voice Generator", "capability": "voice"},
    "airtable": {"label": "Airtable", "capability": "tables"},
    "alpaca": {"label": "Alpaca", "capability": "markets"},
    "amplitude": {"label": "Amplitude", "capability": "analytics"},
    "appdeploy": {"label": "AppDeploy", "capability": "deploy"},
    "apple-music": {"label": "Apple Music", "capability": "music"},
    "asana": {"label": "Asana", "capability": "tasks"},
    "att": {"label": "AT&T", "capability": "telecom"},
    "base44": {"label": "Base44", "capability": "apps"},
    "biorender": {"label": "BioRender", "capability": "diagrams"},
    "calendly": {"label": "Calendly", "capability": "calendar"},
    "call-e": {"label": "CALL-E", "capability": "voice"},
    "caveman-mode": {"label": "Caveman Mode", "capability": "content"},
    "consentlayer": {"label": "ConsentLayer", "capability": "consent"},
    "data-analytics": {"label": "Data Analytics", "capability": "analytics"},
    "dc-pass-contracts": {"label": "DC PASS Contracts", "capability": "agreements"},
    "digitalocean": {"label": "DigitalOcean", "capability": "compute"},
    "docusign": {"label": "Docusign", "capability": "agreements"},
    "figma": {"label": "Figma", "capability": "design-system"},
    "finances": {"label": "Finances", "capability": "billing"},
    "fireflies": {"label": "Fireflies", "capability": "meetings"},
    "formula-genius": {"label": "Formula Genius", "capability": "calculations"},
    "gitbook": {"label": "GitBook", "capability": "knowledge"},
    "github": {"label": "GitHub", "capability": "source"},
    "gmail": {"label": "Gmail", "capability": "email"},
    "godaddy": {"label": "GoDaddy", "capability": "domains"},
    "google-calendar": {"label": "Google Calendar", "capability": "calendar"},
    "google-contacts": {"label": "Google Contacts", "capability": "contacts"},
    "google-drive": {"label": "Google Drive", "capability": "files"},
    "granola": {"label": "Granola", "capability": "meetings"},
    "gsc-wizard": {"label": "GSC Wizard", "capability": "search-intelligence"},
    "hugging-face": {"label": "Hugging Face", "capability": "models"},
    "intuit-quickbooks": {"label": "Intuit QuickBooks", "capability": "accounting"},
    "jotform": {"label": "Jotform", "capability": "forms"},
    "linear": {"label": "Linear", "capability": "tasks"},
    "malwarebytes": {"label": "Malwarebytes", "capability": "security"},
    "meetgeek": {"label": "MeetGeek", "capability": "meetings"},
    "netlify": {"label": "Netlify", "capability": "deploy"},
    "neura-relay": {"label": "Neura Relay MCP", "capability": "decisions"},
    "notion": {"label": "Notion", "capability": "knowledge"},
    "openai-developers": {"label": "OpenAI Developers", "capability": "models"},
    "openai-library": {"label": "OpenAI Library", "capability": "knowledge"},
    "outlook-email": {"label": "Outlook Email", "capability": "email"},
    "pandadoc": {"label": "PandaDoc", "capability": "agreements"},
    "pets": {"label": "Pets", "capability": "companions"},
    "plugin-management": {"label": "Plugin Management", "capability": "connectors"},
    "posthog": {"label": "PostHog", "capability": "observability"},
    "qrcm": {"label": "QRCM", "capability": "compliance"},
    "quicknode": {"label": "Quicknode", "capability": "chain-data"},
    "railway": {"label": "Railway", "capability": "deploy"},
    "remote-desktop-commander": {"label": "Remote Desktop Commander", "capability": "remote-control"},
    "resend": {"label": "Resend", "capability": "email"},
    "retell-ai": {"label": "Retell AI", "capability": "voice"},
    "semrush": {"label": "Semrush", "capability": "search-intelligence"},
    "sharepoint": {"label": "SharePoint", "capability": "files"},
    "sites": {"label": "Sites", "capability": "sites"},
    "slack": {"label": "Slack", "capability": "messages"},
    "stripe": {"label": "Stripe", "capability": "billing"},
    "supabase": {"label": "Supabase", "capability": "data"},
    "todoist": {"label": "Todoist: To Do List & Calendar", "capability": "tasks"},
    "vercel": {"label": "Vercel", "capability": "deploy"},
    "webflow": {"label": "Webflow", "capability": "sites"},
    "windsor-ai": {"label": "Windsor.ai", "capability": "analytics"},
    "workos": {"label": "WorkOS", "capability": "identity"},
    "zoho-crm": {"label": "Zoho CRM", "capability": "crm"},
    "zoom": {"label": "Zoom", "capability": "meetings"}
  }
}
